{
	"schemaVersion": "rag-pipeline-ir/v2",
	"inputs": [
		{
			"id": "corpus",
			"kind": "corpus",
			"bindingMode": "artifact",
			"artifactRole": "corpus",
			"manifestSchema": "rag-corpus-snapshot-manifest/v2",
			"digest": "sha256:b7cdc954aeb8a695e9d9b2b80f7e62031901ef7dca739bad9979ba87b46a591a"
		},
		{
			"id": "query",
			"kind": "query",
			"bindingMode": "dataset"
		},
		{
			"id": "question-representations",
			"kind": "representations",
			"bindingMode": "artifact",
			"artifactRole": "question-representations",
			"manifestSchema": "rag-representation-set-manifest/v2",
			"digest": "sha256:09ed9383359901c7e515870884f82490c053e6d511a2f865a57aada9b4a8baa3"
		},
		{
			"id": "summary-representations",
			"kind": "representations",
			"bindingMode": "artifact",
			"artifactRole": "summary-representations",
			"manifestSchema": "rag-representation-set-manifest/v2",
			"digest": "sha256:615a6fe6c8e4d4cb406e738e0b1ef522a5d55d4eed029a371ee9d613a76fc004"
		}
	],
	"nodes": [
		{
			"id": "n-6761d69ad948a76579b7",
			"operator": {
				"kind": "units.identity",
				"version": "v1"
			},
			"inputs": [
				{
					"port": "corpus",
					"from": {
						"nodeId": "corpus",
						"port": "out"
					}
				}
			],
			"config": {}
		},
		{
			"id": "n-806ee8a8fb83b28f314f",
			"operator": {
				"kind": "chunks.recursive",
				"version": "v1"
			},
			"inputs": [
				{
					"port": "units",
					"from": {
						"nodeId": "n-6761d69ad948a76579b7",
						"port": "units"
					}
				}
			],
			"config": {
				"overlap": 120,
				"size": 800,
				"unicodePolicy": "utf8-boundary"
			}
		},
		{
			"id": "n-feaec7d470a94d9eddcc",
			"operator": {
				"kind": "representations.raw",
				"version": "v1"
			},
			"inputs": [
				{
					"port": "chunks",
					"from": {
						"nodeId": "n-806ee8a8fb83b28f314f",
						"port": "chunks"
					}
				}
			],
			"config": {
				"name": "raw"
			}
		},
		{
			"id": "n-2b1cab72874b310a3bd3",
			"operator": {
				"kind": "index.bleve-multi",
				"version": "v1"
			},
			"inputs": [
				{
					"port": "representations.question",
					"from": {
						"nodeId": "question-representations",
						"port": "out"
					}
				},
				{
					"port": "representations.raw",
					"from": {
						"nodeId": "n-feaec7d470a94d9eddcc",
						"port": "representations"
					}
				},
				{
					"port": "representations.summary",
					"from": {
						"nodeId": "summary-representations",
						"port": "out"
					}
				}
			],
			"config": {
				"representationKinds": ["raw", "summary", "question"]
			}
		},
		{
			"id": "n-1ac64ae45dfdca561d58",
			"operator": {
				"kind": "retrieve.vector",
				"version": "v1"
			},
			"inputs": [
				{
					"port": "index",
					"from": {
						"nodeId": "n-2b1cab72874b310a3bd3",
						"port": "index"
					}
				},
				{
					"port": "query",
					"from": {
						"nodeId": "query",
						"port": "out"
					}
				}
			],
			"config": {
				"filter": {},
				"representation": "summary",
				"topK": 30
			},
			"order": 3
		},
		{
			"id": "n-84767fa25cd970f9c9bc",
			"operator": {
				"kind": "retrieve.vector",
				"version": "v1"
			},
			"inputs": [
				{
					"port": "index",
					"from": {
						"nodeId": "n-2b1cab72874b310a3bd3",
						"port": "index"
					}
				},
				{
					"port": "query",
					"from": {
						"nodeId": "query",
						"port": "out"
					}
				}
			],
			"config": {
				"filter": {},
				"representation": "raw",
				"topK": 30
			},
			"order": 1
		},
		{
			"id": "n-0e83fd1c9a4253a5e1fa",
			"operator": {
				"kind": "collapse.parent",
				"version": "v1"
			},
			"inputs": [
				{
					"port": "hits",
					"from": {
						"nodeId": "n-84767fa25cd970f9c9bc",
						"port": "hits"
					}
				}
			],
			"config": {
				"representative": "scoreThenRepresentationId",
				"scope": "unit"
			},
			"order": 1
		},
		{
			"id": "n-886216f656f95c1b6bc2",
			"operator": {
				"kind": "retrieve.bm25",
				"version": "v1"
			},
			"inputs": [
				{
					"port": "index",
					"from": {
						"nodeId": "n-2b1cab72874b310a3bd3",
						"port": "index"
					}
				},
				{
					"port": "query",
					"from": {
						"nodeId": "query",
						"port": "out"
					}
				}
			],
			"config": {
				"filter": {},
				"representation": "question",
				"topK": 30
			},
			"order": 4
		},
		{
			"id": "n-137dacdb2918e5d33639",
			"operator": {
				"kind": "collapse.parent",
				"version": "v1"
			},
			"inputs": [
				{
					"port": "hits",
					"from": {
						"nodeId": "n-886216f656f95c1b6bc2",
						"port": "hits"
					}
				}
			],
			"config": {
				"representative": "scoreThenRepresentationId",
				"scope": "unit"
			},
			"order": 4
		},
		{
			"id": "n-ae0c8a0fde4b1abc82d4",
			"operator": {
				"kind": "retrieve.bm25",
				"version": "v1"
			},
			"inputs": [
				{
					"port": "index",
					"from": {
						"nodeId": "n-2b1cab72874b310a3bd3",
						"port": "index"
					}
				},
				{
					"port": "query",
					"from": {
						"nodeId": "query",
						"port": "out"
					}
				}
			],
			"config": {
				"filter": {},
				"representation": "summary",
				"topK": 30
			},
			"order": 2
		},
		{
			"id": "n-0c7a5a95d3532262a1b6",
			"operator": {
				"kind": "collapse.parent",
				"version": "v1"
			},
			"inputs": [
				{
					"port": "hits",
					"from": {
						"nodeId": "n-ae0c8a0fde4b1abc82d4",
						"port": "hits"
					}
				}
			],
			"config": {
				"representative": "scoreThenRepresentationId",
				"scope": "unit"
			},
			"order": 2
		},
		{
			"id": "n-b85961f1c8c376d26133",
			"operator": {
				"kind": "retrieve.vector",
				"version": "v1"
			},
			"inputs": [
				{
					"port": "index",
					"from": {
						"nodeId": "n-2b1cab72874b310a3bd3",
						"port": "index"
					}
				},
				{
					"port": "query",
					"from": {
						"nodeId": "query",
						"port": "out"
					}
				}
			],
			"config": {
				"filter": {},
				"representation": "question",
				"topK": 30
			},
			"order": 5
		},
		{
			"id": "n-aaec64c597a664043fb2",
			"operator": {
				"kind": "collapse.parent",
				"version": "v1"
			},
			"inputs": [
				{
					"port": "hits",
					"from": {
						"nodeId": "n-b85961f1c8c376d26133",
						"port": "hits"
					}
				}
			],
			"config": {
				"representative": "scoreThenRepresentationId",
				"scope": "unit"
			},
			"order": 5
		},
		{
			"id": "n-c4bb2124fb0ec2f4d40e",
			"operator": {
				"kind": "retrieve.bm25",
				"version": "v1"
			},
			"inputs": [
				{
					"port": "index",
					"from": {
						"nodeId": "n-2b1cab72874b310a3bd3",
						"port": "index"
					}
				},
				{
					"port": "query",
					"from": {
						"nodeId": "query",
						"port": "out"
					}
				}
			],
			"config": {
				"filter": {},
				"representation": "raw",
				"topK": 30
			}
		},
		{
			"id": "n-d34b7652b9e34fedbe16",
			"operator": {
				"kind": "collapse.parent",
				"version": "v1"
			},
			"inputs": [
				{
					"port": "hits",
					"from": {
						"nodeId": "n-1ac64ae45dfdca561d58",
						"port": "hits"
					}
				}
			],
			"config": {
				"representative": "scoreThenRepresentationId",
				"scope": "unit"
			},
			"order": 3
		},
		{
			"id": "n-dd93eebe451e31c0397d",
			"operator": {
				"kind": "collapse.parent",
				"version": "v1"
			},
			"inputs": [
				{
					"port": "hits",
					"from": {
						"nodeId": "n-c4bb2124fb0ec2f4d40e",
						"port": "hits"
					}
				}
			],
			"config": {
				"representative": "scoreThenRepresentationId",
				"scope": "unit"
			}
		},
		{
			"id": "n-17b824f9c3a652916e37",
			"operator": {
				"kind": "fusion.weighted-rrf",
				"version": "v1"
			},
			"inputs": [
				{
					"port": "channel.question.bm25",
					"from": {
						"nodeId": "n-137dacdb2918e5d33639",
						"port": "parents"
					}
				},
				{
					"port": "channel.question.vector",
					"from": {
						"nodeId": "n-aaec64c597a664043fb2",
						"port": "parents"
					}
				},
				{
					"port": "channel.raw.bm25",
					"from": {
						"nodeId": "n-dd93eebe451e31c0397d",
						"port": "parents"
					}
				},
				{
					"port": "channel.raw.vector",
					"from": {
						"nodeId": "n-0e83fd1c9a4253a5e1fa",
						"port": "parents"
					}
				},
				{
					"port": "channel.summary.bm25",
					"from": {
						"nodeId": "n-0c7a5a95d3532262a1b6",
						"port": "parents"
					}
				},
				{
					"port": "channel.summary.vector",
					"from": {
						"nodeId": "n-d34b7652b9e34fedbe16",
						"port": "parents"
					}
				}
			],
			"config": {
				"rankConstant": 60,
				"weights": {
					"raw.vector": 2
				}
			}
		},
		{
			"id": "n-9c13e05d0c03c4e41835",
			"operator": {
				"kind": "collapse.final",
				"version": "v1"
			},
			"inputs": [
				{
					"port": "parents",
					"from": {
						"nodeId": "n-17b824f9c3a652916e37",
						"port": "parents"
					}
				}
			],
			"config": {
				"representative": "scoreThenRepresentationId",
				"scope": "unit"
			}
		},
		{
			"id": "n-d3bb81c7b80b31ff3f8a",
			"operator": {
				"kind": "hydrate.source-evidence",
				"version": "v1"
			},
			"inputs": [
				{
					"port": "chunks",
					"from": {
						"nodeId": "n-806ee8a8fb83b28f314f",
						"port": "chunks"
					}
				},
				{
					"port": "parents",
					"from": {
						"nodeId": "n-9c13e05d0c03c4e41835",
						"port": "parents"
					}
				}
			],
			"config": {
				"policy": "best-contribution-then-id"
			}
		}
	],
	"outputs": [
		{
			"name": "evidence",
			"kind": "evidence",
			"from": {
				"nodeId": "n-d3bb81c7b80b31ff3f8a",
				"port": "evidence"
			}
		}
	]
}
